"","doc_id","participant","economy_type","reconstructed_chars"
"1",1926,"Rexel Group","Advanced","rent fee share capital register office world version universal registration document file capacity competent authority application provision regulation prior approval accordance article regulation version universal registration document purpose public offering security trade market supplement security note applicable summary supplement entire package approve accordance regulation document free translation original document prepare matter interpretation view opinion express original language docu"
"2",1854,"Plastic Omnium","Advanced","plastic let shape future mobility universal registration document nee integrate report annual financial report corporate governance report statement non financial performance integrate report statutory account presentation plastic statutory account business income statement key figure balance sheet history development group note statutory account organization chart year financial summary significant event subsidiary affiliate business statutory auditor report objective strategy financial stateme"
"3",1974,"SODEXO IBERIA S.A","Advanced","woe version registration document quality life service enhance moment touch daily life ensure positive impact health city planet group remain committed mission improve quality life serve community operate fuel energy member develop country expect average population growth represent world population rapid offer solution adapt increase city create world increase mobility employee economic social challenge strong position generate global develop country emerge middle class technology strong experti"
"4",2274,"Tokyo Century Corporation","Advanced","century report commitment run corporate assist customer partner company develop business pursue growth century corporation integrate report content way century group history business strategy business model equipment current status value strength mobility fleet management strength opportunity risk new fourth medium term management plan create diverse business match financing business strategy specific initiative current trend management environment free regulatory international business pursue b"
"5",1561,"Mitsui & Co., Ltd.","Advanced","business integrate publication integrated report let short term gain mind seek prosperity embrace aspiration word president represent foundation word avoid focused near term profit realize growth create business contribute society long term development release revise version mission vision value corporate management philosophy announcement medium term management plan transform grow revise time year new philosophy put message center include vision create grow business address material issue susta"
"6",1329,"Komatsu Ltd.","Advanced","tee eat day wee enhance quality life special feature business model characteristic initiative base tcfd framework initiative develop people operation grow society flexible global production procurement system social contribution activity business segment corporate governance growth strategy corporate profile message director audit supervisory member message year summary special feature value creation story non financial highlight external evaluation index inclusion machinery business corporate i"
"7",2053,"SharePower Responsible Investing, Inc.","Advanced","responsible invest die lie pee ale advisor register principal connect advisor responsible invest communication progress disclosure contact info responsible invest national office main investing involve risk include loss principal different type investment carry vary degree risk client prepare bear investment original principal loss investing include responsible investing guarantee success document recommendation buy sell security information contain sufficient investment decision buy sell securi"
"8",1580,"Movestic Livforsakring AB","Advanced","sustainability digital development enable new way work simple transparent way enable customer great transparency product opportunity build advisory service available sure service people access independent advice free conflict sustainable society responsibility rest itis responsibility monitor area company focus pension conflict interest arise cover life health contribute focus individual involve focus employee sustainable development create condition require long individual perspective point mov"
"9",2156,"Svenska Handelsbanken AB (publ)","Advanced","found bank branch network way work strong local presence long term approach customer relation goal well profitability average peer competitor home market achieve goal have satisfied customer low cost found satisfied customer branch home market home market conversation ceo head sustainability sustainable development goal manager group mutual fund bank concept working woman volume manage method material sustainability topic bank customer sustainability criterion bank role community responsible fin"
"10",2184,"TDK Electronics AG","Advanced","statement continued support message chairman management board member global compact time pledge support aim objective global compact express principle complete agreement understanding implementation corporate responsibility group company subsidiary lead manufacturer electronic component module system industry manufacturing sale activity world continue embrace principle essential foundation good corporate citizenship business responsibility society document code conduct group recognize role resol"
"11",862,"Eurasian Resources Group","Advanced","industry development global producer address issue responsible sourcing raw material circular economy energy innovation battery found member global battery alliance leader certify product address human right risk global battery sector organization look collaborative solution supply chain issue support world economic forum global battery alliance public private multi stakeholder collaboration global battery develop inclusive innovative world sustainable battery value chain power fourth industrial"
"12",371,"BB Electronics A/S","Advanced","report electronic table content introduction electronic brief electronic contribution sustainability role policy focus step want lead supplier electronic manufacturing service mission recognize reliable professional control business creative solution orient challenge call efficiency production high quality product low cost important parameter comprise efficiency quality importance act sustainability entire supply chain electronic support inclusive sustainable development sustainable business ope"
"13",1465,"MVV Energie AG","Advanced","sustainability figure select key sustainability figure consolidate company change ecological direct emission scope tonne indirect emission scope tonne net saving tonne share renewable energy proprietary electricity generation economic value add conclude development new renewable energy plant electricity generation volume investment euro social number employee woman man share female manager lose time injury frequency rate energy operation average fuel efficiency rate instal renewable energy capac"
"14",348,"Austrian Post","Advanced","deliver post sustainability report reliable post reliable way objective consider mission hand provide service hand responsible ensure mail item reach recipient large small duty provide service accord self concept perform job everyday engage life people reliable post read guide pee different section sustainable gri index annual sustainability internet report development additional goal information sustainability report post wee branch office employee statement ale post integrate corporate sustain"
"15",1868,"ProSiebenSat.1 Media SE","Advanced","society diversity environment governance compliance medium sustainability report responsibility strategy goal organization general disclosure organizational profile strategy ethic integrity magazine public value highlight stakeholder engagement celebrate report practice picture mind clean economic performance anti corruption law environmental social employee diversity anti discrimination product responsibility medium specific disclosure information report profile gri content index assurance tabl"
"16",1705,"OSF Global Ukraine LLC","Developing","description action relevant policy relate human right assessment policy goal description relevance human right company human right risk assessment description policy public commitment company goal human right company respect declaration human right internal regulation document name code conduct available employee respect exception supplier customer selection account adherence partner global compact principle business collaboration organization respect human right company respect human right empl"
"17",2084,"SkanTech ApS","Advanced","cop human right principle assessment policy goal description relevance specific human right issue company base assessment human right risk description policy public commitment company goal human right goal influence employee business partner respect declaration human right environmental protection base commitment set code conduct recent future supplier implementation description concrete action implement human right policy address human right risk respond human right relate concern take followin"
"18",2085,"SkanTech ApS","Advanced","cop human right principle assessment policy goal description relevance specific human right issue company base assessment human right risk description policy public commitment company goal human right goal influence employee business partner respect declaration human right environmental protection base commitment set code conduct recent future supplier implementation description concrete action implement human right policy address human right risk respond human right relate concern take followin"
"19",1352,"Krusell (Thailand) Co., Ltd","Developing","financial statement year end independent auditor report shareholder board director opinion audit financial statement company comprise statement financial position statement income statement change shareholder equity year end note financial statement include summary significant accounting policy opinion financial statement present material respect financial position financial performance year end accordance financial reporting standard non accountable entity basis opinion conduct audit accordance"
"20",2380,"Welltec A/S","Advanced","annual report approve annual shareholder meet company profile management consolidate key figure ratio financial review outlook risk corporate social responsibility company detail statement management annual report independent auditor report financial statement parent company consolidate group financial statement branch definition annual report company profile global service provider develop deliver technology service intend transform oil gas industry game change solution dedicate optimize constr"
"21",2342,"Valmet Oyj","Advanced","report board director financial indicator see calculation indicator consolidated financial statement consolidated statement income consolidated statement comprehensive income consolidated statement financial position consolidated statement cash flow consolidate statement change equity note consolidated financial statement parent company financial statement parent company statement income parent company statement financial position parent company statement cash flow note parent company financial "
"22",1907,"Raisio Plc","Advanced","set corporate responsibility report healthy responsible content president carbon energy efficiency material good food plan international company healthy produce good food plan food feed product focus health good year achievement sustainable food chain sustainable development profitable growth ensure strong plan product responsible raw material expertise drive innovation share list certification ensure responsibility company shareholder group net sale friendly packaging feed promote total compara"
"23",2101,"Son of a Tailor ApS","Advanced","ape air pee ete meet covid fee face production team safe request customer offer art sale total produce face tree tee equivalent save son global compact report make custom fit order material high quality reduce emission comparison conventional production approach result white paper conduct compare carbon footprint son tailor buy traditional retail commerce analysis show supply chain emission son tailor low traditional commerce low retail order approach eliminate inventory mean take place product "
"24",1197,"Ingleby Farms & Forests ApS","Advanced","sit core eye building trust content see ete soil ree aoe sit aoe toe animal community farm executive review year celebrate year anniversary sustainability report farm evidence base approach comprehensive measurement indicator sustainability reporting help well farmer tee aie content farm safety severe weather event safety team member principle agriculture help high priority team continue focus mitigate impact safety result significant reduction weather lose time injury frequency rate nature avoi"
"25",1557,"Mitsubishi Logistics Corporation","Advanced","eat environmental social report year fiscal accountability effect business activity society environment disclose goal detail promotion activity perspective group principle business management report describe management philosophy code conduct easy understand manner promotion csr promotion csr employee emphasis communication core subject describe major csr activity guidance social responsibility iso guidance global standard organizational governance establish industrial standard corporate governa"
"26",1341,"Korea Land & Housing Corporation","Advanced","human nature content strengthen sustainability management system report message highlight core value sustainability management sustainable management strategy report overview report principle corporation publish report compile accordance core option ona yearly basis share communicate stakeholder global reporting standard economic environmental social result achieve sustainable management sustainability report assurance link sustainability strategy related major business order ensure accuracy rel"
"27",1945,"Rubycon Corporation","Advanced","core seal pea wee pay ree sit report target report publication group company policy content report prepare annual report term include non financial information message company environmental social effort corporate philosophy group company overview group company list item summary concrete csr policy system example activity policy actual result consumer safety protection concern important issue fair business practice work information relate procurement guideline activity post website csr plan conv"
"28",444,"Bin Sowaid Trading & Import Est.","Developing","general commitment global compact commitment global compact pleased confirm trading import support principle global compact human right labour environment anti corruption communication express implement principle committed make global compact principle strategy culture day operation company join global compact clear direction drive business stage time contribute society event transformation future bring trading import corporate social responsibility recognize key requirement participation global"
"29",1445,"MDPI AG","Advanced","academic open access global compact communication progress open access publish run eat ace fight fact statement continued support pleased confirm reaffirm support principle global compact area human right labour environment anti corruption demonstrate commitment sustainable management responsibility employee global house duty develop responsible practice ensure future company planet commit principle associate global compact focus contribute following define goal encourage time employee activity "
"30",2427,"ZenSar Technologies","Developing","technology general pleased confirm support principle global compact human right labour environment anti corruption communication express implement principle committed make global compact principle strategy culture day operation company engage collaborative project advance broad development goal addition like declare intention commitment focus gender equality woman empowerment principle line sustainable development goal principle global compact clear statement commitment stakeholder public change"
"31",342,"Attica Holdings S.A. - Attica Group","Advanced","responsible mining responsibility report pee indicator economic performance number title disclosure requirement disclosure explanation topic material economic performance cause operation activity support material supply chain topic boundary material topic boundary topic limit include description jurisdiction mining operation impact occur organization involvement impact example organization cause contribute impact link impact business relationship specific limitation topic disclosure financial in"
"32",1318,"Kinross Gold","Advanced","priority gold corporation eat pose pie ice oil meal sum report progress past year deliver commitment responsible mining goal provide transparent account impact performance relationship stakeholder report include performance highlight sustainability data table communication progress gri index content overview manage sustainability act gold profile sustainability vision ethical ceo message stakeholder sustainability strategy human right sustainability recognition sustainability governance structur"
"33",1216,"International Petroleum Corporation","Advanced","pee nee industry global context advance reporting approach sustainability people employment community environment emission climate strategy land biodiversity water management waste management ethic governance corporate governance tee revenue transparency human appendix datum support responsible ensure engagement local community high principle business conduct area involvement integration asset integral business nation creation past key stakeholder business partner share benefit activity support "
"34",2389,"White arkitekter AB","Advanced","annual sustainability report earn man white found vision improve society beginning company culture social responsibility approach white grow guide principle beginning responsible act large practice respect participation company own employee business activity follow consist staff office principle global compact agenda sustainable involve project development goal form basis different country head assignment office remain original address believe ness learn important attribute employee own company "
"35",2319,"Udviklingsselskabet By & Havn I/S","Advanced","lie site ask see pee eat pea pie bet son pie seal team non ere nee lay tie company ambition develop new run port address ambition involve create high quality healthy sustainable new room good life activity finance public country infrastructure make easy sustainable contact info date support global compact membership global number employee real estate investment service goal effort distribution cop green mobility urban green blue space efficiency community employee health safety labour market ant"
"36",163,"AB Storstockholms Lokaltrafik","Advanced","report group english translation sustainability report event version report apply delivery address telephone register office public transport visit public transport report group sustainability effort constitute statutory sustainability report group report concern group report comprise mobility service people unable travel public transport people mobility allowance travel free charge transport service mobility medical journey day mobility service comprise cent equivalent emit vehicle public trans"
"37",852,"Ernst and Young d.o.o. - Croatia","Developing","vat fee ace ree nee tie ice see ore fee nee age eat age late pee woe see bee eat global chairman letter support global compact principle sustainable development goal create long term value create long term value people importance diversity create long term value society social impact site tee global review look continue large investment technology crucial covid environment order serve client people create long term value mean ensure safety travel restriction place comprehensive guidance meeting "
"38",729,"Deloitte","Advanced","connect impact global impact report table content video message leadership number global chief executive officer global board chair story connection help protect public interest impact matter year history learn lesson important solve problem business society require collaboration cooperation connection simple time option economic social political disruption bring industry force seek alliance opportunity idea embrace year fair pee owe existence ability connect entire business model connection bus"
"39",522,"CVS Health","Advanced","ere end ice sea wet ane aie son pee net race pass die pee eat pet paper overview people business community planet transform ceo letter healthy people letter healthy business corporate profile healthy community csr governance report material topic stakeholder engagement people business community planet stakeholder report press outbreak change way live operate business health emergency team disease monitor current international domestic environment relate risk respond investment local community su"
