"","doc_id","participant","economy_type","reconstructed_chars"
"48",564,"Charter Hall Group","Advanced","ice soft foe ore ree ceo message governance create value highlight performance datum principle ungc approach index statement social report annual sustainability report state environmental datum cover business activity charter report pertain asset activity group manage property fund asset operational control financial year end include datum outside entity supplier contractor material case information provide event take place close prepare report guide financial year global reporting standard core"
"49",1926,"Rexel Group","Advanced","rent fee share capital register office world version universal registration document file capacity competent authority application provision regulation prior approval accordance article regulation version universal registration document purpose public offering security trade market supplement security note applicable summary supplement entire package approve accordance regulation document free translation original document prepare matter interpretation view opinion express original language docu"
"50",1974,"SODEXO IBERIA S.A","Advanced","woe version registration document quality life service enhance moment touch daily life ensure positive impact health city planet group remain committed mission improve quality life serve community operate fuel energy member develop country expect average population growth represent world population rapid offer solution adapt increase city create world increase mobility employee economic social challenge strong position generate global develop country emerge middle class technology strong experti"
"51",1854,"Plastic Omnium","Advanced","plastic let shape future mobility universal registration document nee integrate report annual financial report corporate governance report statement non financial performance integrate report statutory account presentation plastic statutory account business income statement key figure balance sheet history development group note statutory account organization chart year financial summary significant event subsidiary affiliate business statutory auditor report objective strategy financial stateme"
"52",596,"Clifford Chance LLP","Advanced","chance responsible business report role help sustainable inclusive future new legal regulatory stakeholder landscape use expertise capability work positive difference commitment rule law justice equality foundation global managing partner content page change impact progress page responsible balance business strategy transition solid foundation human impact thank harassment growth page map view objective stand view growth page power tackle structural client reverse mentor discrimination face page"
"53",1104,"Herbert Smith Freehills LLP","Advanced","lie sit pea free eat see ree eye ere heat set area ape see eat set par tee great par ree ote son male year extraordinary year time diversify see start human cost disruption cause firm conversation decade action initiative covid global pandemic clear accelerate delivery sustainable difficult addition response development goal sdgs pandemic month action change ethnicity share fourth see large area framework measure accountability communication progress report region global network demonstrate comm"
"54",2264,"Thomson Reuters","Advanced","letter social impact trust year president ceo renewable energy global share social need set science base carbon reduction act integrity impact result target align degree independence hold strengthen society people business strengthen foundation great strength company society provide information people diverse inclusive workforce drive expertise insight people trust innovation connect community society achieve human risk focus right foundation corporate equality woe social impact work drive acces"
